04:56:12.683673 IP lamp-ubuntu-s-1vcpu-1gb-tor1-01.ssh > pool-99-234-215-82.cpe.net.cable.rogers.com.57299: Flags [P.], seq 141145844:141145952, ack 1132041894, win 1028, length 108
04:56:12.683789 IP lamp-ubuntu-s-1vcpu-1gb-tor1-01.ssh > pool-99-234-215-82.cpe.net.cable.rogers.com.57299: Flags [P.], seq 108:144, ack 1, win 1028, length 36
04:56:12.683868 IP lamp-ubuntu-s-1vcpu-1gb-tor1-01.ssh > pool-99-234-215-82.cpe.net.cable.rogers.com.57299: Flags [P.], seq 144:196, ack 1, win 1028, length 52
04:56:12.683937 IP lamp-ubuntu-s-1vcpu-1gb-tor1-01.ssh > pool-99-234-215-82.cpe.net.cable.rogers.com.57299: Flags [P.], seq 196:264, ack 1, win 1028, length 68
04:56:12.684030 IP lamp-ubuntu-s-1vcpu-1gb-tor1-01.ssh > pool-99-234-215-82.cpe.net.cable.rogers.com.57299: Flags [P.], seq 264:332, ack 1, win 1028, length 68
04:56:12.684104 IP lamp-ubuntu-s-1vcpu-1gb-tor1-01.ssh > pool-99-234-215-82.cpe.net.cable.rogers.com.57299: Flags [P.], seq 332:368, ack 1, win 1028, length 36
04:56:12.685684 IP pool-99-234-215-82.cpe.net.cable.rogers.com.57299 > lamp-ubuntu-s-1vcpu-1gb-tor1-01.ssh: Flags [P.], seq 1:37, ack 4294967208, win 251, length 36
04:56:12.685685 IP pool-99-234-215-82.cpe.net.cable.rogers.com.57299 > lamp-ubuntu-s-1vcpu-1gb-tor1-01.ssh: Flags [.], ack 0, win 251, length 0
04:56:12.685848 IP lamp-ubuntu-s-1vcpu-1gb-tor1-01.ssh > pool-99-234-215-82.cpe.net.cable.rogers.com.57299: Flags [P.], seq 368:404, ack 37, win 1028, length 36
04:56:12.716049 IP pool-99-234-215-82.cpe.net.cable.rogers.com.57299 > lamp-ubuntu-s-1vcpu-1gb-tor1-01.ssh: Flags [.], ack 144, win 250, length 0