04:55:37.480698 IP 137.184.164.212.22 > 99.234.215.82.57299: Flags [P.], seq 141130732:141130920, ack 1132028690, win 939, length 188
04:55:37.491986 IP 99.234.215.82.57299 > 137.184.164.212.22: Flags [.], ack 4294967260, win 252, length 0
04:55:37.509455 IP 99.234.215.82.57299 > 137.184.164.212.22: Flags [P.], seq 1:37, ack 4294967260, win 252, length 36
04:55:37.509643 IP 137.184.164.212.22 > 99.234.215.82.57299: Flags [P.], seq 188:224, ack 37, win 939, length 36
04:55:37.515739 IP 99.234.215.82.57299 > 137.184.164.212.22: Flags [.], ack 188, win 251, length 0
04:55:37.539673 IP 99.234.215.82.57299 > 137.184.164.212.22: Flags [P.], seq 37:73, ack 188, win 251, length 36
04:55:37.539843 IP 137.184.164.212.22 > 99.234.215.82.57299: Flags [P.], seq 224:260, ack 73, win 939, length 36
04:55:37.578408 IP 99.234.215.82.57299 > 137.184.164.212.22: Flags [P.], seq 73:109, ack 224, win 251, length 36
04:55:37.578619 IP 137.184.164.212.22 > 99.234.215.82.57299: Flags [P.], seq 260:296, ack 109, win 939, length 36
04:55:37.608643 IP 99.234.215.82.57299 > 137.184.164.212.22: Flags [P.], seq 109:145, ack 260, win 250, length 36